{
  "$schema": "http://json-schema.org/draft-07/schema#",
  "title": "brief.json",
  "type": "object",
  "required": ["id", "title_working", "archetype", "target_seconds", "format", "status"],
  "properties": {
    "id": { "type": "string" },
    "title_working": { "type": "string" },
    "archetype": {
      "type": "string",
      "enum": ["ideas", "mini-demo", "diagram", "comparison"]
    },
    "angle": { "type": "string", "description": "The original human take that makes this video ours." },
    "audience": { "type": "string" },
    "target_seconds": { "type": "number" },
    "format": { "type": "string", "enum": ["long", "short", "long+short"] },
    "search_term": { "type": "string" },
    "task": { "type": "string", "description": "The painful task being automated (data-entry, invoicing, scheduling, emailing, lookups...)." },
    "sector": { "type": "string", "description": "Optional sector flavor (schools, accounting, hospitality...)." },
    "tool": { "type": "string", "description": "Primary tool shown (Sheets, Excel, Outlook, Notion, Claude...)." },
    "score": { "type": "number", "description": "Predicted popularity 0-100 (free signals + judgment)." },
    "lane": {
      "type": "string",
      "enum": ["desk-fixes", "desk-loops", "automation-breakdowns", "desk-notes", "ai-how-to", "tool-review", "ai-news", "everyone-asks-ai"],
      "description": "Content lane / series. Drives the variety soft-cap (no >2 of the same lane in a row)."
    },
    "value_type": {
      "type": "array",
      "minItems": 1,
      "items": {
        "type": "string",
        "enum": ["saves-time", "saves-money", "avoids-mistake", "teaches-system", "surprising-truth", "corrects-misbelief"]
      },
      "description": "Which audience-value type(s) this video delivers (the idea-pass Audience Value Test). >=1 required to clear the value gate."
    },
    "takeaway": { "type": "string", "description": "The ONE reusable thing a viewer can apply or believe differently tomorrow. Defined at the idea-pass; the script-pass checks it was delivered." },
    "approved_tools": {
      "type": "array",
      "items": { "type": "string" },
      "description": "Paid SaaS product names the OWNER pre-approved to name on screen for this video (paid promo or personal endorsement). Anything not listed is blocked by the QA denylist."
    },
    "bridge": {
      "type": "object",
      "additionalProperties": false,
      "description": "Short → Long ecosystem inputs: which long video a Short drives discovery to + the copy-paste resource surfaced in the pin/description. Consumed by build-metadata.buildBridge (the deliberate Short→Long→pin→template→cross-post chain).",
      "properties": {
        "related_long_id": { "type": "string", "description": "content id of the long video this video bridges to (the parent long for a nested Short; a topically-aligned long for a STANDALONE Short — e.g. an inbox Short → the n8n inbox-triage long)." },
        "related_long_title": { "type": "string", "description": "Human title of the related long (used in the caption/checklist while its real URL is still <LONG_URL>)." },
        "template_link": { "type": "string", "description": "Copy-paste template / resource URL (e.g. an n8n workflow) surfaced in the description AND the pinned comment." }
      }
    },
    "value_score": { "type": "number", "minimum": 0, "maximum": 10, "description": "Idea-pass content-value score (0-10). >=9 auto-qualify, 7.5-9 owner decides, <7.5 reject." },
    "value_band": { "type": "string", "enum": ["qualify", "owner", "reject"], "description": "Idea-pass gate decision derived from value_score + hard gates." },
    "sources": {
      "type": "array",
      "items": {
        "type": "object",
        "required": ["title", "url"],
        "properties": {
          "title": { "type": "string" },
          "url": { "type": "string" }
        }
      }
    },
    "voice_rate": { "type": "string", "pattern": "^[+-]\\d+%$", "description": "Per-video speaking rate for the narration (edge-tts / Azure prosody, e.g. '+3%', '-6%'). A nested Short without its own brief inherits the parent's." },
    "voice_rate_key": { "type": "string", "pattern": "^[+-]\\d+%$", "description": "Speaking rate for the script's KEY TAKES (scenes[].key_takes) — slower than voice_rate so the line lands. Absent = key takes use voice_rate." },
    "format_recipe": { "type": "object", "description": "Per-video FORMAT override (a partial pipeline/shared/formats recipe, e.g. { \"intro\": { \"short_seconds\": 0 } }), deep-merged last by lib/format.mjs. Separate from `format` (long/short), which is a string." },
    "status": {
      "type": "string",
      "enum": [
        "new", "ideated", "scripted", "script_approved", "voiced",
        "planned", "captured", "rendered", "qa_passed", "ready", "published", "rejected"
      ]
    }
  }
}
