{
  "id": "002-what-is-ai-automation",
  "title_working": "What AI Automation Actually Is - and Why I Built This Channel",
  "archetype": "ideas",
  "angle": "Everyone chases giant AI systems and ignores the boring daily tasks that actually waste their time. This channel is about those small wins - and I'm learning them in public and showing them in plain English as I go.",
  "audience": "Curious builders/freelancers and small-business folks who keep hearing about AI but haven't turned it into anything useful yet",
  "target_seconds": 300,
  "format": "long+short",
  "task": "other",
  "score": 70,
  "status": "scripted"
}
